{
  "type": "echo-workshop-item",
  "schemaVersion": 1,
  "id": "echo.lattice-wall",
  "title": "Lattice · 音乐拼贴墙",
  "version": "1.1.0",
  "content": {
    "kind": "plugin-package",
    "entry": "community.echo"
  },
  "compatibility": {
    "minEchoVersion": "26.9.5",
    "pluginApiVersion": 2
  },
  "files": [
    {
      "path": "community.echo",
      "size": 211706,
      "sha256": "e3363d64cf5911da86c7fceb9b185549c3357e26a51271aab2b9ce5cc2046a9f"
    },
    {
      "path": "LICENSE",
      "size": 34523,
      "sha256": "0d96a4ff68ad6d4b6f1f30f713b18d5184912ba8dd389f86aa7710db079abcb0"
    },
    {
      "path": "NOTICE.md",
      "size": 1640,
      "sha256": "7eef88970d474cbf83c2de62b49919b580f418d36ecfdd6337b7cbbfb3e37b00"
    }
  ],
  "license": {
    "id": "AGPL-3.0-only",
    "holder": "Lattice Wall contributors",
    "sourceUrl": "https://github.com/bailuoqi/lattice-wall"
  }
}
